{
  "module_id": "module-01",
  "module_number": 1,
  "title": "Studio English Foundations I: Garments, Tools, and Classroom Language",
  "description": "A first-semester ESP module that introduces fashion-study identity language, studio routines, garment vocabulary, visual description, and short portfolio-ready writing.",
  "weeks": [
    {
      "week_id": "m01w01",
      "week_number": 1,
      "title": "Welcome to Fashion Design English",
      "status": "seeded"
    },
    {
      "week_id": "m01w02",
      "week_number": 2,
      "title": "The Fashion Studio",
      "status": "seeded"
    },
    {
      "week_id": "m01w03",
      "week_number": 3,
      "title": "Garments and Categories",
      "status": "seeded"
    },
    {
      "week_id": "m01w04",
      "week_number": 4,
      "title": "Parts of a Garment",
      "status": "seeded"
    },
    {
      "week_id": "m01w05",
      "week_number": 5,
      "title": "Body, Figure, and Observation Drawing",
      "status": "seeded"
    },
    {
      "week_id": "m01w06",
      "week_number": 6,
      "title": "Color, Shape, and Line",
      "status": "seeded"
    },
    {
      "week_id": "m01w07",
      "week_number": 7,
      "title": "Fabric and Texture Basics",
      "status": "seeded"
    },
    {
      "week_id": "m01w08",
      "week_number": 8,
      "title": "Sewing Actions",
      "status": "seeded"
    },
    {
      "week_id": "m01w09",
      "week_number": 9,
      "title": "Introduction to Patternmaking English",
      "status": "planned"
    },
    {
      "week_id": "m01w10",
      "week_number": 10,
      "title": "Describing a Sketch",
      "status": "planned"
    },
    {
      "week_id": "m01w11",
      "week_number": 11,
      "title": "Design Details",
      "status": "planned"
    },
    {
      "week_id": "m01w12",
      "week_number": 12,
      "title": "Creative Inspiration",
      "status": "planned"
    },
    {
      "week_id": "m01w13",
      "week_number": 13,
      "title": "Giving Simple Design Feedback",
      "status": "planned"
    },
    {
      "week_id": "m01w14",
      "week_number": 14,
      "title": "Mini Design Board",
      "status": "planned"
    }
  ],
  "learning_goals": [
    "Build beginner-accessible English routines connected to Fashion Design coursework.",
    "Develop confidence with core studio vocabulary, simple descriptions, and guided self-introductions.",
    "Prepare learners to produce short written and spoken design-related outputs."
  ],
  "professional_outcomes": [
    "Students can explain who they are as Fashion Design students in simple English.",
    "Students can understand and use recurring studio and coursework vocabulary.",
    "Students can begin building short portfolio-friendly written artifacts."
  ],
  "language_outcomes": [
    "Use sentence frames for self-introduction, preference, and learning goals.",
    "Recognize high-frequency course, studio, and design vocabulary.",
    "Write short guided responses with clear meaning and basic accuracy."
  ]
}
